### ISSUE TITLE
FC03 als Slave

### ISSUE THREAD

**Issue by an-klam** [ioBroker/ioBroker.modbus#251]
Hauptfrage 
Kann es sein, dass der Adapter als Slave kein FC03 unterstützt?

Jetzt die Erklärung warum ich das vermute:

Ich möchte den Modbus Adapter im Slave Modus nutzen um einen Drehstromzähler zu simulieren.
Der Wechselrichter ist bereits der Master und fragt immer mal wieder über RS485 Modbus RTU die Werte eines Zählers ab.

Der Master/WR kommuniziert über einen Waveshare RS485 to eth (B) Adapter mit dem iobroker. Der Waveshare übernimmt die "übersetzung" von RTU in TCP.
Mit tcpdump habe ich mal ein Telegramm aufgefangen, dass vom Master (Waveshare) an den IOBroker geht.
Auf der RS485 Leitung ist das ein  
01 03 00 0B 00 01 F5 C8
--------------------^^^^ crc
-------------^^^^------ anzahl der zu lesenden Register
------^^^^------------ Startadresse
---^^------------------ Funktionscode (03 read holding register)
^^--------------------- GeräteID

Die Anfrage scheint auch im iobroker anzukommen. Hier gibts aber dann den Fehler FC3 und direkt ein tcp telegramm:
![grafik](https://user-images.githubusercontent.com/75025337/179815966-5d0ad0e6-a5c8-4611-92d2-3286f27cf68b.png)

Weder in debug noch in Silly ist aber zu sehen warum der fehler **FC3 request outside register boundaries: from 11, len 1. Expected max address 0** kommt.
Eine genauere Fehlerbeschreibung wäre hilfreich. Vielleicht kann der Support von waveshare den Fehler korrigieren wenn bekannt welche Adresse beim Slave (iobroker) ankommt

hier mal tcpdump bei einem Telegram (01 03 00 0B 00 01 F5 C8):
192.168.100.170 ist der waveshare und 166 der rapberry (iobroker)

`
20:00:17.207500 IP 192.168.100.170.21623 > 192.168.100.166.4196: Flags [P.], seq 1:13, ack 1, win 3000, length 12
	0x0000:  e45f 0115 89f8 2861 98ea ccaf 0800 4500
	0x0010:  0034 0053 0000 4006 2fd0 c0a8 64aa c0a8
	0x0020:  64a6 5477 1064 e802 77fc 271e 7c42 5018 
	0x0030:  0bb8 f006 0000 0010 0000 0006 0103 000b  
	0x0040:  0001

20:00:17.207549 IP 192.168.100.166.4196 > 192.168.100.170.21623: Flags [.], ack 13, win 64072, length 0
	0x0000:  2861 98ea ccaf e45f 0115 89f8 0800 4500
	0x0010:  0028 8e18 4000 4006 6216 c0a8 64a6 c0a8
	0x0020:  64aa 1064 5477 271e 7c42 e802 7808 5010
	0x0030:  fa48 4abc 0000

20:00:17.310136 IP 192.168.100.166.4196 > 192.168.100.170.21623: Flags [P.], seq 0:9, ack 13, win 64072, length 9
	0x0000:  2861 98ea ccaf e45f 0115 89f8 0800 4500
	0x0010:  0031 8e19 4000 4006 620c c0a8 64a6 c0a8
	0x0020:  64aa 1064 5477 271e 7c42 e802 7808 5018
	0x0030:  fa48 4ac5 0000 0010 0000 0003 0183 02

20:00:17.310136 IP 192.168.100.166.4196 > 192.168.100.170.21623: Flags [P.], seq 0:9, ack 13, win 64072, length 9
	0x0000:  2861 98ea ccaf e45f 0115 89f8 0800 4500
	0x0010:  0031 8e19 4000 4006 620c c0a8 64a6 c0a8
	0x0020:  64aa 1064 5477 271e 7c42 e802 7808 5018
	0x0030:  fa48 4ac5 0000 0010 0000 0003 0183 02
`

hier nochmal ein tcpdump von einer radzio Abfrage (auch das inputregister 0b/12)
`
20:27:31.286474 IP CN-PC0T1ADF.64182 > 192.168.100.166.4196: Flags [P.], seq 180:192, ack 166, win 510, length 12
	0x0000:  e45f 0115 89f8 a0af bd82 8dc7 0800 4500
	0x0010:  0034 027d 4000 8006 ae2e c0a8 6421 c0a8
	0x0020:  64a6 fab6 1064 43e4 c1a5 6946 97bd 5018
	0x0030:  01fe 50eb 0000 0000 0000 0006 0104 000b
	0x0040:  0001

20:27:31.286540 IP 192.168.100.166.4196 > CN-PC0T1ADF.64182: Flags [.], ack 192, win 502, length 0
	0x0000:  a0af bd82 8dc7 e45f 0115 89f8 0800 4500
	0x0010:  0028 d007 4000 4006 20b0 c0a8 64a6 c0a8
	0x0020:  6421 1064 fab6 6946 97bd 43e4 c1b1 5010
	0x0030:  01f6 4a33 0000

20:27:31.388169 IP 192.168.100.166.4196 > CN-PC0T1ADF.64182: Flags [P.], seq 166:177, ack 192, win 502, length 11
	0x0000:  a0af bd82 8dc7 e45f 0115 89f8 0800 4500
	0x0010:  0033 d008 4000 4006 20a4 c0a8 64a6 c0a8
	0x0020:  6421 1064 fab6 6946 97bd 43e4 c1b1 5018
	0x0030:  01f6 4a3e 0000 0000 0000 0005 0104 0200
	0x0040:  0d
	
20:27:31.438371 IP CN-PC0T1ADF.64182 > 192.168.100.166.4196: Flags [.], ack 177, win 510, length 0
	0x0000:  e45f 0115 89f8 a0af bd82 8dc7 0800 4500
	0x0010:  0028 027f 4000 8006 ae38 c0a8 6421 c0a8
	0x0020:  64a6 fab6 1064 43e4 c1b1 6946 97c8 5010
	0x0030:  01fe 51fe 0000 0000 0000 0000
`

Obwohl auf Input registers eingestellt ist, scheint radzio die holding register zu lesen (04 anstatt 03)
Stelle ich Radzio auf holding registers und frage nach den gleichen adressen erhalte ich auch den Fehler FC03
Kann es sein, dass der Adapter als Slave kein FC03 unterstützt?

Radzio und der Waveshare laufen in die Fehlermeldung auch wenn ich die Register in den holdingregistern anlege und mit daten fülle

**Comment by an-klam** [comment]
Ich habe mal etwas hin und her versucht und für mem.length wird bei den holdingRegistern in diesem Fall irgendwie immer 0 angenommen.
Beim Start des Adapters werden aber Objekte für die Holdingregister initialisiert.


`2022-08-10 14:39:33.260 - info: host.raspberrypi stopInstance system.adapter.modbus.2 (force=false, process=true)
2022-08-10 14:39:33.270 - info: modbus.2 (23801) Got terminate signal TERMINATE_YOURSELF
2022-08-10 14:39:33.276 - info: host.raspberrypi stopInstance system.adapter.modbus.2 send kill signal
2022-08-10 14:39:33.278 - info: modbus.2 (23801) terminating
2022-08-10 14:39:33.282 - debug: modbus.2 (23801) Plugin sentry destroyed
2022-08-10 14:39:33.283 - info: modbus.2 (23801) Terminated (ADAPTER_REQUESTED_TERMINATION): Without reason
2022-08-10 14:39:34.027 - info: host.raspberrypi instance system.adapter.modbus.2 terminated with code 11 (ADAPTER_REQUESTED_TERMINATION)
2022-08-10 14:39:36.419 - info: host.raspberrypi instance system.adapter.modbus.2 started with pid 24857
2022-08-10 14:39:38.333 - debug: modbus.2 (24857) Redis Objects: Use Redis connection: 127.0.0.1:9001
2022-08-10 14:39:38.443 - debug: modbus.2 (24857) Objects client ready ... initialize now
2022-08-10 14:39:38.452 - debug: modbus.2 (24857) Objects create System PubSub Client
2022-08-10 14:39:38.458 - debug: modbus.2 (24857) Objects create User PubSub Client
2022-08-10 14:39:38.529 - debug: modbus.2 (24857) Objects client initialize lua scripts
2022-08-10 14:39:38.544 - debug: modbus.2 (24857) Objects connected to redis: 127.0.0.1:9001
2022-08-10 14:39:38.587 - debug: modbus.2 (24857) Redis States: Use Redis connection: 127.0.0.1:9000
2022-08-10 14:39:38.604 - debug: modbus.2 (24857) States create System PubSub Client
2022-08-10 14:39:38.606 - debug: modbus.2 (24857) States create User PubSub Client
2022-08-10 14:39:38.630 - debug: modbus.2 (24857) States connected to redis: 127.0.0.1:9000
2022-08-10 14:39:38.884 - debug: modbus.2 (24857) Plugin sentry Initialize Plugin (enabled=true)
2022-08-10 14:39:39.622 - info: modbus.2 (24857) starting. Version 5.0.4 in /opt/iobroker/node_modules/iobroker.modbus, node: v14.17.6, js-controller: 4.0.23
2022-08-10 14:39:40.216 - debug: modbus.2 (24857) Initialize Objects for disInputs: []
2022-08-10 14:39:40.220 - debug: modbus.2 (24857) Initialize Objects for coils: []
2022-08-10 14:39:40.221 - debug: modbus.2 (24857) Initialize Objects for inputRegs: []
2022-08-10 14:39:40.221 - debug: modbus.2 (24857) Initialize Objects for holdingRegs: [{"_address":100,"name":"Spannung_L1_N","description":"","unit":"","type":"uint16be","len":1,"factor":1,"offset":0,"formula":"","role":"level","room":"","poll":"","wp":"","cw":"","isScale":"","address":100,"deviceId":1,"id":"holdingRegisters.100_Spannung_L1_N"},{"_address":102,"name":"Spannung_L2_N","description":"","unit":"","type":"uint16be","len":1,"factor":1,"offset":0,"formula":"","role":"level","room":"","poll":"","wp":"","cw":"","isScale":"","deviceId":1,"address":102,"id":"holdingRegisters.102_Spannung_L2_N"},{"_address":104,"name":"Spannung_L3_N","description":"","unit":"","type":"uint16be","len":1,"factor":1,"offset":0,"formula":"","role":"level","room":"","poll":"","wp":"","cw":"","isScale":"","deviceId":1,"address":104,"id":"holdingRegisters.104_Spannung_L3_N"},{"_address":106,"name":"Spannung_L1_L2","description":"","unit":"","type":"uint16be","len":1,"factor":1,"offset":0,"formula":"","role":"level","room":"","poll":"","wp":"","cw":"","isScale":"","deviceId":1,"address":106,"id":"holdingRegisters.106_Spannung_L1_L2"},{"_address":108,"name":"Spannung_L2_L3","description":"","unit":"","type":"uint16be","len":1,"factor":1,"offset":0,"formula":"","role":"level","room":"","poll":"","wp":"","cw":"","isScale":"","deviceId":1,"address":108,"id":"holdingRegisters.108_Spannung_L2_L3"},{"_address":110,"name":"Spannung_L3_L1","description":"","unit":"","type":"uint16be","len":1,"factor":1,"offset":0,"formula":"","role":"level","room":"","poll":"","wp":"","cw":"","isScale":"","deviceId":1,"address":110,"id":"holdingRegisters.110_Spannung_L3_L1"}]
2022-08-10 14:39:40.223 - debug: modbus.2 (24857) Add holdingRegisters.100_Spannung_L1_N: {"_id":"holdingRegisters.100_Spannung_L1_N","type":"state","common":{"name":"","role":"level","type":"number","read":false,"write":true,"def":0,"unit":""},"native":{"regType":"holdingRegs","address":100,"deviceId":1,"type":"uint16be","len":1,"offset":0,"factor":1,"poll":""}}
2022-08-10 14:39:40.230 - debug: modbus.2 (24857) Add holdingRegisters.102_Spannung_L2_N: {"_id":"holdingRegisters.102_Spannung_L2_N","type":"state","common":{"name":"","role":"level","type":"number","read":false,"write":true,"def":0,"unit":""},"native":{"regType":"holdingRegs","address":102,"deviceId":1,"type":"uint16be","len":1,"offset":0,"factor":1,"poll":""}}
2022-08-10 14:39:40.232 - debug: modbus.2 (24857) Add holdingRegisters.104_Spannung_L3_N: {"_id":"holdingRegisters.104_Spannung_L3_N","type":"state","common":{"name":"","role":"level","type":"number","read":false,"write":true,"def":0,"unit":""},"native":{"regType":"holdingRegs","address":104,"deviceId":1,"type":"uint16be","len":1,"offset":0,"factor":1,"poll":""}}
2022-08-10 14:39:40.248 - debug: modbus.2 (24857) Add holdingRegisters.106_Spannung_L1_L2: {"_id":"holdingRegisters.106_Spannung_L1_L2","type":"state","common":{"name":"","role":"level","type":"number","read":false,"write":true,"def":0,"unit":""},"native":{"regType":"holdingRegs","address":106,"deviceId":1,"type":"uint16be","len":1,"offset":0,"factor":1,"poll":""}}
2022-08-10 14:39:40.252 - debug: modbus.2 (24857) Add holdingRegisters.108_Spannung_L2_L3: {"_id":"holdingRegisters.108_Spannung_L2_L3","type":"state","common":{"name":"","role":"level","type":"number","read":false,"write":true,"def":0,"unit":""},"native":{"regType":"holdingRegs","address":108,"deviceId":1,"type":"uint16be","len":1,"offset":0,"factor":1,"poll":""}}
2022-08-10 14:39:40.253 - debug: modbus.2 (24857) Add holdingRegisters.110_Spannung_L3_L1: {"_id":"holdingRegisters.110_Spannung_L3_L1","type":"state","common":{"name":"","role":"level","type":"number","read":false,"write":true,"def":0,"unit":""},"native":{"regType":"holdingRegs","address":110,"deviceId":1,"type":"uint16be","len":1,"offset":0,"factor":1,"poll":""}}
2022-08-10 14:39:40.965 - debug: modbus.2 (24857) Slave ready to start
2022-08-10 14:39:41.240 - debug: modbus.2 (24857) server is listening on port
2022-08-10 14:39:41.242 - debug: modbus.2 (24857) initiating read coils request handler.
2022-08-10 14:39:41.242 - debug: modbus.2 (24857) setting request handler
2022-08-10 14:39:41.243 - debug: modbus.2 (24857) initiating read discrete inputs request handler.
2022-08-10 14:39:41.244 - debug: modbus.2 (24857) setting request handler
2022-08-10 14:39:41.244 - debug: modbus.2 (24857) initiating read holding registers request handler.
2022-08-10 14:39:41.245 - debug: modbus.2 (24857) setting request handler
2022-08-10 14:39:41.246 - debug: modbus.2 (24857) initiating read input registers request handler.
2022-08-10 14:39:41.247 - debug: modbus.2 (24857) setting request handler
2022-08-10 14:39:41.248 - debug: modbus.2 (24857) initiating write multiple coils request handler.
2022-08-10 14:39:41.249 - debug: modbus.2 (24857) setting request handler
2022-08-10 14:39:41.250 - debug: modbus.2 (24857) initiating write multiple registers request handler.
2022-08-10 14:39:41.250 - debug: modbus.2 (24857) setting request handler
2022-08-10 14:39:41.251 - debug: modbus.2 (24857) initiating write single coil request handler.
2022-08-10 14:39:41.252 - debug: modbus.2 (24857) setting request handler
2022-08-10 14:39:41.253 - debug: modbus.2 (24857) initiating write single register request handler.
2022-08-10 14:39:41.253 - debug: modbus.2 (24857) setting request handler
2022-08-10 14:39:45.951 - debug: modbus.2 (24857) new connection
2022-08-10 14:39:45.953 - debug: modbus.2 (24857) + Clients connected: 192.168.100.166`
